menu,comment,mood,mood2,mood3
ねむれねむれねむれねむれ,むにゃむにゃむにゃ,,ねちゃったよね,ねちゃったよね
お誕生日をきっかけに、ずっと伝えたかったありがとうを。,あなたが声をかけてくれたおかげで、私の世界は広がって、コミュニティにも一歩踏み出せました。,イベントに参加するときも、ほそじゅんさんの存在があったからです。,いつも背中を押してくれて、本当にありがとう。これからも、どうぞよろしく！ Mayumi Sakagami,
ほそじゅんさん、お誕生日おめでとうございます🎂✨✨,CWBJがあったかいのはつながりの真ん中にほそじゅんさんがいてくれるおかけなのです。,いつも本当にありがとうございます。 AKIKO MASUDAYA,,
ほそじゅん、お誕生日おめでとう！！,いつも本当に楽しそうに色々なコミュニティに飛び込んで、私たちも巻き込んでくれてありがとう❤️,完全に世界広がりました！,これからも一緒に色んなことやっていきましょう💪　Atsuko Tsushima,
ほそじゅんへ　初めてじっくりお話ししたのは、MCTサミットでした。最後まで参加して、そのあと一緒に夕食をご一緒し、いろいろなお話ができましたね。😊,いつもさまざまなイベントにお誘いいただき、本当にありがとうございます。,勉強熱心で努力家なところを尊敬していますが、どうか無理をしすぎず、ゆっくり過ごす時間も大切にしてください。,🙇‍♀️これからもどうぞよろしくお願いいたします。,お誕生日おめでとうございます。🎉🎊 立石千鶴子
ほそじゅん！　まつじゅん！です。,ハッピーバースデー🎉❤,いくつになっても好奇心旺盛、何にでも果敢に挑戦するバイタリティー！,皆の憧れ👀〰️💕,これからも一緒にたのしい企画を創っていきましょう.今日がとびきり素敵な日でありますように💐 松木純子
